{
  "$schema": "https://json-schema.org/draft/2020-12/schema",
  "$id": "https://set-apps.github.io/ai-submodule/schemas/formal-spec.schema.json",
  "title": "FormalSpec",
  "description": "Structured specification format richer than GitHub issue templates. Provides structured acceptance criteria, dependency declarations, risk pre-classification, and machine-verifiable completion conditions. Designed for Phase 5e Spec-Driven Interface — enables agents to verify implementation completeness programmatically.",
  "type": "object",
  "required": [
    "spec_version",
    "spec_id",
    "title",
    "origin",
    "acceptance_criteria",
    "risk_classification",
    "completion_conditions",
    "created_at"
  ],
  "properties": {
    "spec_version": {
      "type": "string",
      "const": "1.0.0",
      "description": "Schema version for this formal spec format."
    },
    "spec_id": {
      "type": "string",
      "format": "uuid",
      "description": "Unique identifier for this specification."
    },
    "title": {
      "type": "string",
      "minLength": 1,
      "maxLength": 200,
      "description": "Short title for the specification."
    },
    "description": {
      "type": "string",
      "description": "Detailed description of the work to be performed."
    },
    "origin": {
      "type": "string",
      "enum": ["human", "runtime-signal", "goals-item", "retrospective"],
      "description": "How this spec was created. human: manually authored. runtime-signal: generated from a runtime DI. goals-item: derived from GOALS.md. retrospective: identified during post-merge retrospective."
    },
    "issue_ref": {
      "type": "string",
      "description": "Reference to the corresponding GitHub issue (e.g., '#163'). Null if no issue exists yet.",
      "pattern": "^#\\d+$"
    },
    "acceptance_criteria": {
      "type": "array",
      "minItems": 1,
      "description": "Structured acceptance criteria. Each criterion has a testable assertion and a verification method.",
      "items": {
        "$ref": "#/$defs/acceptance_criterion"
      }
    },
    "dependencies": {
      "type": "array",
      "description": "Explicit dependency declarations for this spec.",
      "items": {
        "$ref": "#/$defs/dependency"
      }
    },
    "risk_classification": {
      "type": "object",
      "description": "Pre-classified risk assessment for this spec.",
      "required": ["severity", "policy_profile"],
      "properties": {
        "severity": {
          "type": "string",
          "enum": ["critical", "high", "medium", "low", "negligible"],
          "description": "Expected risk severity of the change."
        },
        "policy_profile": {
          "type": "string",
          "enum": ["default", "fin_pii_high", "infrastructure_critical"],
          "description": "Governance policy profile applicable to this change."
        },
        "affected_layers": {
          "type": "array",
          "description": "Governance layers affected by this change.",
          "items": {
            "type": "string",
            "enum": ["intent", "cognitive", "execution", "runtime", "evolution"]
          }
        },
        "compliance_flags": {
          "type": "array",
          "description": "Compliance frameworks relevant to this change.",
          "items": {
            "type": "string",
            "enum": ["soc2", "pci-dss", "hipaa", "gdpr", "none"]
          }
        },
        "data_classification": {
          "type": "string",
          "enum": ["public", "internal", "confidential", "restricted"],
          "description": "Highest data classification level affected."
        }
      },
      "additionalProperties": false
    },
    "completion_conditions": {
      "type": "array",
      "minItems": 1,
      "description": "Machine-verifiable conditions that must all be true for the spec to be considered complete.",
      "items": {
        "$ref": "#/$defs/completion_condition"
      }
    },
    "scope": {
      "type": "object",
      "description": "Explicit scope boundaries for the change.",
      "properties": {
        "files_to_create": {
          "type": "array",
          "items": {
            "type": "object",
            "required": ["path", "purpose"],
            "properties": {
              "path": { "type": "string" },
              "purpose": { "type": "string" }
            },
            "additionalProperties": false
          }
        },
        "files_to_modify": {
          "type": "array",
          "items": {
            "type": "object",
            "required": ["path", "change"],
            "properties": {
              "path": { "type": "string" },
              "change": { "type": "string" }
            },
            "additionalProperties": false
          }
        },
        "files_to_delete": {
          "type": "array",
          "items": {
            "type": "object",
            "required": ["path", "reason"],
            "properties": {
              "path": { "type": "string" },
              "reason": { "type": "string" }
            },
            "additionalProperties": false
          }
        },
        "out_of_scope": {
          "type": "array",
          "description": "Explicitly excluded work — prevents scope creep.",
          "items": { "type": "string" }
        }
      },
      "additionalProperties": false
    },
    "panels_required": {
      "type": "array",
      "description": "Governance panels that must evaluate this change.",
      "items": {
        "type": "string"
      }
    },
    "created_at": {
      "type": "string",
      "format": "date-time",
      "description": "ISO 8601 timestamp of when this spec was created."
    },
    "updated_at": {
      "type": "string",
      "format": "date-time",
      "description": "ISO 8601 timestamp of the last update to this spec."
    },
    "author": {
      "type": "string",
      "description": "Author of this spec (human name, agent persona, or 'system')."
    },
    "status": {
      "type": "string",
      "enum": ["draft", "approved", "in_progress", "verification", "completed", "abandoned"],
      "description": "Lifecycle status of this spec.",
      "default": "draft"
    }
  },
  "additionalProperties": false,
  "$defs": {
    "acceptance_criterion": {
      "type": "object",
      "description": "A single acceptance criterion with a testable assertion.",
      "required": ["id", "description", "verification_method"],
      "properties": {
        "id": {
          "type": "string",
          "pattern": "^AC-\\d+$",
          "description": "Acceptance criterion identifier (e.g., 'AC-1')."
        },
        "description": {
          "type": "string",
          "description": "Human-readable description of what must be true."
        },
        "verification_method": {
          "type": "string",
          "enum": ["automated_test", "schema_validation", "file_exists", "grep_match", "manual_review", "panel_emission"],
          "description": "How this criterion is verified. automated_test: a test suite asserts it. schema_validation: JSON Schema validates the output. file_exists: a specific file must exist. grep_match: a pattern must match in specified files. manual_review: requires human confirmation. panel_emission: a panel must emit a passing verdict."
        },
        "verification_target": {
          "type": "string",
          "description": "Target for automated verification — file path, test name, schema path, or grep pattern depending on verification_method."
        },
        "priority": {
          "type": "string",
          "enum": ["must", "should", "could"],
          "description": "MoSCoW priority. must: blocks completion. should: expected but negotiable. could: nice to have.",
          "default": "must"
        }
      },
      "additionalProperties": false
    },
    "dependency": {
      "type": "object",
      "description": "A dependency this spec has on another artifact or condition.",
      "required": ["type", "description"],
      "properties": {
        "type": {
          "type": "string",
          "enum": ["blocking", "non-blocking", "informational"],
          "description": "blocking: must be resolved before work starts. non-blocking: should be resolved but work can proceed. informational: awareness only."
        },
        "description": {
          "type": "string",
          "description": "What this dependency is."
        },
        "ref": {
          "type": "string",
          "description": "Reference to the dependency — issue number, spec_id, file path, or external URL."
        },
        "resolved": {
          "type": "boolean",
          "description": "Whether this dependency has been resolved.",
          "default": false
        }
      },
      "additionalProperties": false
    },
    "completion_condition": {
      "type": "object",
      "description": "A machine-verifiable condition for spec completion.",
      "required": ["id", "type", "assertion"],
      "properties": {
        "id": {
          "type": "string",
          "pattern": "^CC-\\d+$",
          "description": "Completion condition identifier (e.g., 'CC-1')."
        },
        "type": {
          "type": "string",
          "enum": [
            "file_exists",
            "file_not_exists",
            "schema_valid",
            "grep_match",
            "grep_no_match",
            "ci_check_passes",
            "panel_approves",
            "test_passes",
            "documentation_updated"
          ],
          "description": "Type of machine-verifiable check."
        },
        "assertion": {
          "type": "string",
          "description": "The specific assertion to verify — file path, schema reference, grep pattern, check name, or panel name depending on type."
        },
        "description": {
          "type": "string",
          "description": "Human-readable description of what this condition verifies."
        }
      },
      "additionalProperties": false
    }
  }
}
